,id_str,id,created_at,text,text_cleaned,hashtags,retweet_count,sentiment,positive_sentiment,negative_sentiment,created_year,created_month,created_day,created_at_int,date
1629,1119572078175367168,1,2019-04-20 12:02:38,The Fake News Media is doing everything possible to stir up and anger the pols and as many people as possible seldo… https://t.co/lvCYg9Xry8,fake news medium everything possible stir anger pol many people possible seldo httpstcolvcygxry,[],20082,-0.13999999999999999,0,0,2019,4,20,1555761758000000000,1555718400000.0
1630,1119569774286135297,1,2019-04-20 11:53:29,Despite the fact that the Mueller Report should not have been authorized in the first place &amp; was written as nastil… https://t.co/hSqS7N0TH0,despite fact mueller report authorize first place amp write nastil httpstcohsqsnth,[],24362,0.25,1,0,2019,4,20,1555761209000000000,1555718400000.0
1631,1119377807497363456,1,2019-04-19 23:10:40,"Wishing a Happy Passover to all those celebrating in America, Israel, and around the world! https://t.co/h3wgLZ4mxS",wish happy passover celebrate america israel around world httpstcohwglzmx,[],20408,0.8,1,0,2019,4,19,1555715440000000000,1555632000000.0
1632,1119372874442108928,1,2019-04-19 22:51:04,“TRUMP HAS BEEN TOTALLY VINDICATED” https://t.co/ZjmmVD1T4z,trump totally vindicate httpstcozjmmvdtz,[],17759,0.0,0,0,2019,4,19,1555714264000000000,1555632000000.0
1633,1119355283585761282,1,2019-04-19 21:41:10,Time for Democrats to accept reality https://t.co/3SyAnkSVlX,time democrat accept reality httpstcosyanksvlx,[],19016,0.0,0,0,2019,4,19,1555710070000000000,1555632000000.0
1634,1119350750096785409,1,2019-04-19 21:23:10,"The Washington Post and New York Times are, in my opinion, two of the most dishonest media outlets around. Truly, t… https://t.co/wyogohR0yb",washington post new york time opinion two dishonest medium outlet around truly httpstcowyogohryb,[],19549,-0.08181818181818182,0,0,2019,4,19,1555708990000000000,1555632000000.0
1635,1119341792460247040,1,2019-04-19 20:47:34,"....big, fat, waste of time, energy and money - $30,000,000 to be exact. It is now finally time to turn the tables… https://t.co/YjYZAoNUFc",big fat waste time energy money exact -PRON- finally time turn table httpstcoyjyzaonufc,[],39788,0.012499999999999997,0,0,2019,4,19,1555706854000000000,1555632000000.0
1636,1119211274712375297,1,2019-04-19 12:08:56,"...agreed to testify, it was not necessary for me to respond to statements made in the “Report” about me, some of w… https://t.co/MmsyKs6G2w",agree testify necessary respond statement make report httpstcommsyksgw,[],31753,0.0,0,0,2019,4,19,1555675736000000000,1555632000000.0
1637,1119207303700471809,1,2019-04-19 11:53:09,"Statements are made about me by certain people in the Crazy Mueller Report, in itself written by 18 Angry Democrat… https://t.co/8SSXuBchfu",statement make certain people crazy mueller report write angry democrat httpstcossxubchfu,[],25632,-0.29523809523809524,0,1,2019,4,19,1555674789000000000,1555632000000.0
1638,1119066791161077760,1,2019-04-19 02:34:48,Kimberley Strassel should get the Pulitzer. She is a treasure (and I don’t know her) who correctly called the Russi… https://t.co/gsfwqiX9og,kimberley strassel get pulitzer -PRON- treasure -PRON- know correctly call russi httpstcogsfwqixog,[],22329,0.0,0,0,2019,4,19,1555641288000000000,1555632000000.0
1639,1119037461190066176,1,2019-04-19 00:38:16,“The Mueller Report is perhaps the single most humiliating thing that has ever happened to the White House Press in… https://t.co/SfynIGwhdB,mueller report perhaps single humiliating thing ever happen white house press httpstcosfynigwhdb,[],30361,-0.03571428571428571,0,0,2019,4,19,1555634296000000000,1555632000000.0
1640,1119034770221088768,1,2019-04-19 00:27:34,"“If dozens of Federal prosecutors spent two years trying to charge you with a crime, and found they couldn’t, it wo… https://t.co/E0BPPwRcKC",dozen federal prosecutor spend two year try charge crime find wo httpstcoebppwrckc,[],26688,0.0,0,0,2019,4,19,1555633654000000000,1555632000000.0
1641,1119024554431713280,1,2019-04-18 23:46:58,"When there is not an underlying crime with regard to Collusion (in fact, the whole thing was a made up fraud), it i… https://t.co/uZEQGQLrXN",underlie crime regard collusion fact whole thing make fraud httpstcouzeqgqlrxn,[],20871,0.2,0,0,2019,4,18,1555631218000000000,1555545600000.0
1642,1119019875203153921,1,2019-04-18 23:28:23,Anything the Russians did concerning the 2016 Election was done while Obama was President. He was told about it and… https://t.co/adGILtxyRC,anything russian concern election obama president -PRON- tell httpstcoadgiltxyrc,[],31202,0.0,0,0,2019,4,18,1555630103000000000,1555545600000.0
1643,1118990550235877376,1,2019-04-18 21:31:51,"“Donald Trump was being framed, he fought back. That is not Obstruction.” @JesseBWatters  I had the right to end th… https://t.co/tMlkJ5Fa9u",donald trump frame fight back obstruction jessebwatter -PRON- right end th httpstcotmlkjfau,[],33433,0.14285714285714285,0,0,2019,4,18,1555623111000000000,1555545600000.0
1644,1118976983797567488,1,2019-04-18 20:37:57,"Today, I was thrilled to host the @WWP Soldier Ride once again at the @WhiteHouse. We were all deeply honored to be… https://t.co/I0GYOq1Re5",today -PRON- thrilled host wwp soldier ride whitehouse -PRON- deeply honor httpstcoigyoqre,[],15038,0.3,1,0,2019,4,18,1555619877000000000,1555545600000.0
1645,1118921900858793985,1,2019-04-18 16:59:04,"As I have been saying all along, NO COLLUSION - NO OBSTRUCTION! https://t.co/BnMB5mvHAM",-PRON- say along collusion obstruction httpstcobnmbmvham,[],38727,0.0,0,0,2019,4,18,1555606744000000000,1555545600000.0
1646,1118876219381026818,1,2019-04-18 13:57:33,https://t.co/222atp7wuB,httpstcoatpwub,[],111611,0.0,0,0,2019,4,18,1555595853000000000,1555545600000.0
1647,1118860425599307777,1,2019-04-18 12:54:47,No Collusion - No Obstruction! https://t.co/diggF8V3hl,collusion obstruction httpstcodiggfvhl,[],35181,0.0,0,0,2019,4,18,1555592087000000000,1555545600000.0
1648,1118854454802096131,1,2019-04-18 12:31:03,Attorney General William Barr’s Press Conference today at 9:30 AM ET. Watch on @FoxNews @OANN,attorney general william barr press conference today et watch foxnew oann,[],12976,0.05000000000000002,0,0,2019,4,18,1555590663000000000,1555545600000.0
1649,1118848431932493824,1,2019-04-18 12:07:08,PRESIDENTIAL HARASSMENT!,presidential harassment,[],29156,0.0,0,0,2019,4,18,1555589228000000000,1555545600000.0
1650,1118845290721812480,1,2019-04-18 11:54:39,"The Greatest Political Hoax of all time! Crimes were committed by Crooked, Dirty Cops and DNC/The Democrats.",great political hoax time crime commit crooked dirty cop dncthe democrat,[],25933,0.05000000000000002,0,0,2019,4,18,1555588479000000000,1555545600000.0
1651,1118682321236918273,1,2019-04-18 01:07:04,Nolte: Poll Shows Media Failed to Gaslight Public About Trump Campaign Spying https://t.co/06OZcBE08b via @BreitbartNews,nolte poll show medium fail gaslight public trump campaign spy httpstcoozcbeb via breitbartnew,[],18288,-0.25,0,1,2019,4,18,1555549624000000000,1555545600000.0
1652,1118548389652774914,1,2019-04-17 16:14:52,....in my conversation yesterday with President @EmmanuelMacron of France. I also wished both Pope Francis and Pres… https://t.co/MM51VwUYu8,conversation yesterday president emmanuelmacron france -PRON- also wish pope francis pre httpstcommvwuyu,[],13470,0.0,0,0,2019,4,17,1555517692000000000,1555459200000.0
1653,1118548388352598016,1,2019-04-17 16:14:52,Just had a wonderful conversation with @Pontifex Francis offering condolences from the People of the United States… https://t.co/j8wYTHscXn,wonderful conversation pontifex francis offer condolence people united state httpstcojwythscxn,[],17913,1.0,1,0,2019,4,17,1555517692000000000,1555459200000.0
1654,1118480533854543881,1,2019-04-17 11:45:14,"Democrats in Congress must return from their Vacations and change the Immigration Laws, or the Border, despite the… https://t.co/CGIB957pgG",democrat congress must return vacation change immigration law border despite httpstcocgibpgg,[],25641,0.0,0,0,2019,4,17,1555501514000000000,1555459200000.0
1655,1118477897356992512,1,2019-04-17 11:34:45,"Wow! FBI made 11 payments to Fake Dossier’s discredited author, Trump hater Christopher Steele. @OANN… https://t.co/J5usyBMMnq",wow fbi make payment fake dossier discredit author trump hater christopher steele oann httpstcojusybmmnq,[],37935,-0.2,0,0,2019,4,17,1555500885000000000,1555459200000.0
1656,1118370255091507201,1,2019-04-17 04:27:01,"On Trumps ICC Win, Dems and Republicans See Eye to Eye | RealClearPolitics https://t.co/6S6mP6yH3A",trump icc win dem republican see eye eye realclearpolitic httpstcosmpyha,[],10214,0.8,1,0,2019,4,17,1555475221000000000,1555459200000.0
1657,1118324360383746050,1,2019-04-17 01:24:39,I believe it will be Crazy Bernie Sanders vs. Sleepy Joe Biden as the two finalists to run against maybe the best E… https://t.co/qHn7CkEoq2,-PRON- believe crazy bernie sander vs sleepy joe biden two finalist run maybe good httpstcoqhnckeoq,[],27957,0.04999999999999999,0,0,2019,4,17,1555464279000000000,1555459200000.0
1658,1118321122624331776,1,2019-04-17 01:11:47,"Bernie Sanders and wife should pay the Pre-Trump Taxes on their almost $600,000 in income. He is always complaining… https://t.co/OCaJ6IfulO",bernie sander wife pay pretrump tax almost income -PRON- always complain httpstcoocajifulo,[],26438,0.0,0,0,2019,4,17,1555463507000000000,1555459200000.0
1659,1118317574301863936,1,2019-04-17 00:57:41,Many Trump Fans &amp; Signs were outside of the @FoxNews Studio last night in the now thriving (Thank you President Tru… https://t.co/vB5NyPTyI0,many trump fan amp sign outside foxnew studio last night thrive thank president tru httpstcovbnyptyi,[],21540,0.16666666666666666,0,0,2019,4,17,1555462661000000000,1555459200000.0
1660,1118282780633382912,1,2019-04-16 22:39:26,Just signed a critical bill to formalize drought contingency plans for the Colorado River. Thanks to @SenMcSallyAZ… https://t.co/OU80bg9EUK,sign critical bill formalize drought contingency plan colorado river thank senmcsallyaz httpstcooubgeuk,[],14980,0.0,0,0,2019,4,16,1555454366000000000,1555372800000.0
1661,1118227380789817345,1,2019-04-16 18:59:17,No Collusion - No Obstruction! https://t.co/cbFOEEyLtM,collusion obstruction httpstcocbfoeeyltm,[],15973,0.0,0,0,2019,4,16,1555441157000000000,1555372800000.0
1662,1118212755918589952,1,2019-04-16 18:01:11,"I will be in Green Bay, Wisconsin on Saturday, April 27th at the Resch Center — 7:00pm (CDT). Big crowd expected!… https://t.co/w8k4V1m0xk",-PRON- green bay wisconsin saturday april th resch center -- pm cdt big crowd expect httpstcowkvmxk,[],15433,-0.10000000000000002,0,0,2019,4,16,1555437671000000000,1555372800000.0
1663,1118155023849017345,1,2019-04-16 14:11:46,"So weird to watch Crazy Bernie on @FoxNews. Not surprisingly, @BretBaier and the “audience” was so smiley and nice.… https://t.co/MsOz4iMVNi",weird watch crazy bernie foxnew surprisingly bretbaier audience smiley nice httpstcomsozimvni,[],19819,0.04999999999999996,0,0,2019,4,16,1555423906000000000,1555372800000.0
1664,1118145749148209153,1,2019-04-16 13:34:55,No Collusion - No Obstruction!,collusion obstruction,[],23577,0.0,0,0,2019,4,16,1555421695000000000,1555372800000.0
1665,1118137564173565955,1,2019-04-16 13:02:23,"A must read, Andy McCarthy’s column today, “Dirty dealings of dirt devils who concocted Trump-Russia probe.” The gr… https://t.co/zttKbbJrJa",must read andy mccarthy column today dirty dealing dirt devil concocted trumprussia probe gr httpstcozttkbbjrja,[],23986,-0.6,0,1,2019,4,16,1555419743000000000,1555372800000.0
1666,1117910111236681728,1,2019-04-15 21:58:34,God bless the people of France!,god bless people france,[],37269,0.0,0,0,2019,4,15,1555365514000000000,1555286400000.0
1667,1117909721766174720,1,2019-04-15 21:57:02,The forgotten voters of the 2016 Election are now doing great. The Steel Industry is rebuilding and expanding at a… https://t.co/0YZQjgK2RG,forget voter election great steel industry rebuild expand httpstcoyzqjgkrg,[],22340,0.8,1,0,2019,4,15,1555365422000000000,1555286400000.0
1668,1117844987293487104,1,2019-04-15 17:39:48,So horrible to watch the massive fire at Notre Dame Cathedral in Paris. Perhaps flying water tankers could be used… https://t.co/chuLADsVgU,horrible watch massive fire notre dame cathedral paris perhaps fly water tanker could use httpstcochuladsvgu,[],37243,-0.06666666666666665,0,0,2019,4,15,1555349988000000000,1555286400000.0
1669,1117843954437767168,1,2019-04-15 17:35:41,"Spoke to @TigerWoods to congratulate him on the great victory he had in yesterday’s @TheMasters, &amp; to inform him th… https://t.co/mPv0qzTIba",spoke tigerwood congratulate great victory yesterday themaster amp inform th httpstcompvqztiba,[],32224,0.8,1,0,2019,4,15,1555349741000000000,1555286400000.0
1670,1117829011860787200,1,2019-04-15 16:36:19,Heading to the Great State of Minnesota!,head great state minnesota,[],11729,0.8,1,0,2019,4,15,1555346179000000000,1555286400000.0
1671,1117826076774789126,1,2019-04-15 16:24:39,"....Since there was no Collusion, why was there an Investigation in the first place! Answer - Dirty Cops, Dems and Crooked Hillary!",since collusion investigation first place answer dirty cop dem crooked hillary,[],21243,-0.11666666666666665,0,0,2019,4,15,1555345479000000000,1555286400000.0
1672,1117825163234426882,1,2019-04-15 16:21:01,"The Mueller Report, which was written by 18 Angry Democrats who also happen to be Trump Haters (and Clinton Support… https://t.co/gDIQBA33Iq",mueller report write angry democrat also happen trump hater clinton support httpstcogdiqbaiq,[],21119,-0.5,0,1,2019,4,15,1555345261000000000,1555286400000.0
1673,1117821219875594240,1,2019-04-15 16:05:21,"Those Illegal Immigrants who can no longer be legally held (Congress must fix the laws and loopholes) will be, subj… https://t.co/xGxp17T5Dy",illegal immigrant longer legally hold congress must fix law loophole subj httpstcoxgxptdy,[],25194,-0.15,0,0,2019,4,15,1555344321000000000,1555286400000.0
1674,1117813315269320709,1,2019-04-15 15:33:56,"Mark Morgan, President Obama’s Border Patrol Chief, gave the following message to me: “President Trump, stay the co… https://t.co/B1djaFB0Pw",mark morgan president obama border patrol chief give follow message president trump stay co httpstcobdjafbpw,[],20813,0.0,0,0,2019,4,15,1555342436000000000,1555286400000.0
1675,1117813230678814722,1,2019-04-15 15:33:36,I finally agree with @Cher! https://t.co/i5acSgUrCk,-PRON- finally agree cher httpstcoiacsgurck,[],30627,0.0,0,0,2019,4,15,1555342416000000000,1555286400000.0
1676,1117793692281135104,1,2019-04-15 14:15:58,The Radical Left Democrats will never be satisfied with anything we give them. They will always Resist and Obstruct!,radical leave democrat never satisfied anything give -PRON- always resist obstruct,[],18070,-0.25,0,1,2019,4,15,1555337758000000000,1555286400000.0
1677,1117787850399989766,1,2019-04-15 13:52:45,THEY SPIED ON MY CAMPAIGN (We will never forget)!,spied campaign -PRON- never forget,[],32742,0.0,0,0,2019,4,15,1555336365000000000,1555286400000.0
1678,1117782316557000704,1,2019-04-15 13:30:46,"Before Nancy, who has lost all control of Congress and is getting nothing done, decides to defend her leader, Rep.… https://t.co/RGnWFL3x9c",nancy lose control congress get nothing decide defend leader rep httpstcorgnwflxc,[],32574,0.0,0,0,2019,4,15,1555335046000000000,1555286400000.0
1679,1117751619469361152,1,2019-04-15 11:28:47,Congress should come back to D.C. now and FIX THE IMMIGRATION LAWS!,congress come back dc fix immigration laws,[],22957,0.0,0,0,2019,4,15,1555327727000000000,1555286400000.0
1680,1117748268820201472,1,2019-04-15 11:15:28,"Mueller, and the A.G. based on Mueller findings (and great intelligence), have already ruled No Collusion, No Obstr… https://t.co/x7HBiAPMmr",mueller ag base mueller finding great intelligence already rule collusion obstr httpstcoxhbiapmmr,[],23440,0.0,0,0,2019,4,15,1555326928000000000,1555286400000.0
1681,1117736685721223168,1,2019-04-15 10:29:27,"What do I know about branding, maybe nothing (but I did become President!), but if I were Boeing, I would FIX the B… https://t.co/VVyRzxxsh5",-PRON- know brand maybe nothing -PRON- become president -PRON- boeing -PRON- would fix httpstcovvyrzxxsh,[],21906,0.0,0,0,2019,4,15,1555324167000000000,1555286400000.0
1682,1117604192175230976,1,2019-04-15 01:42:58,"Chinese Telecom Giant Huawei hires former Obama Cyber Security Official as a lobbyist. This is not good, or accepta… https://t.co/QAFfG32jOj",chinese telecom giant huawei hire former obama cyber security official lobbyist good accepta httpstcoqaffgjoj,[],22127,0.175,0,0,2019,4,15,1555292578000000000,1555286400000.0
1683,1117601418855243778,1,2019-04-15 01:31:56,.@SteveHiltonx  “This is President Trump trying to deliver on his promises while the bureaucratic machine fights hi… https://t.co/DehN6fC9zY,stevehiltonx president trump try deliver promise bureaucratic machine fight hi httpstcodehnfczy,[],15449,0.0,0,0,2019,4,15,1555291916000000000,1555286400000.0
1684,1117585367358738433,1,2019-04-15 00:28:09,"Such a “puff piece” on Nancy Pelosi by @60minutes, yet her leadership has passed no meaningful Legislation. All the… https://t.co/eob8VSAFbR",puff piece nancy pelosi minute yet leadership pass meaningful legislation httpstcoeobvsafbr,[],24127,0.5,1,0,2019,4,15,1555288089000000000,1555286400000.0
1685,1117505376486866944,1,2019-04-14 19:10:18,Love people who are great under pressure. What a fantastic life comeback for a really great guy! https://t.co/41MtJtYEjq,love people great pressure fantastic life comeback really great guy httpstcomtjtyejq,[],25149,0.625,1,0,2019,4,14,1555269018000000000,1555200000000.0
1686,1117496743032250368,1,2019-04-14 18:36:00,"Congratulations to @TigerWoods., a truly Great Champion!",congratulation tigerwood truly great champion,[],29161,0.8,1,0,2019,4,14,1555266960000000000,1555200000000.0
1687,1117494716516507650,1,2019-04-14 18:27:57,Watching final hole of @TheMasters. @TigerWoods is looking GREAT!,watch final hole themaster tigerwood look great,[],8643,0.4,1,0,2019,4,14,1555266477000000000,1555200000000.0
1688,1117486994018451458,1,2019-04-14 17:57:15,"Great Masters going on right now. @TigerWoods is leading with 2 holes left to play. Very exciting, tune in!",great master go right tigerwood lead hole leave play exciting tune,[],11301,0.461904761904762,1,0,2019,4,14,1555264635000000000,1555200000000.0
1689,1117428291227533312,1,2019-04-14 14:04:00,"If the Fed had done its job properly, which it has not, the Stock Market would have been up 5000 to 10,000 addition… https://t.co/8l4tdvil2n",fed job properly stock market would addition httpstcoltdviln,[],22793,0.0,0,0,2019,4,14,1555250640000000000,1555200000000.0
1690,1117242926654947328,1,2019-04-14 01:47:25,Just out: The USA has the absolute legal right to have apprehended illegal immigrants transferred to Sanctuary Citi… https://t.co/SpzUmcPCV6,usa absolute legal right apprehend illegal immigrant transfer sanctuary citi httpstcospzumcpcv,[],43369,0.04642857142857143,0,0,2019,4,14,1555206445000000000,1555200000000.0
1691,1117218059738079233,1,2019-04-14 00:08:37,"Democrats must change the Immigration Laws FAST. If not, Sanctuary Cities must immediately ACT to take care of the… https://t.co/rs5J3HJfIX",democrat must change immigration law fast sanctuary city must immediately act take care httpstcorsjhjfix,[],29910,0.2,0,0,2019,4,14,1555200517000000000,1555200000000.0
1692,1117216153728897024,1,2019-04-14 00:01:02,....So interesting to see the Mayor of Oakland and other Sanctuary Cities NOT WANT our currently “detained immigran… https://t.co/FeFoLlrjgi,interesting see mayor oakland sanctuary city want currently detain immigran httpstcofefollrjgi,[],33842,0.25,1,0,2019,4,14,1555200062000000000,1555200000000.0
1693,1117213859696267264,1,2019-04-13 23:51:55,"I never offered Pardons to Homeland Security Officials, never ordered anyone to close our Southern Border (although… https://t.co/SGnDMi0sab",-PRON- never offer pardon homeland security official never order anyone close southern border although httpstcosgndmisab,[],19793,0.0,0,0,2019,4,13,1555199515000000000,1555113600000.0
1694,1117210469629071360,1,2019-04-13 23:38:27,"....When I won the Election in 2016, the @nytimes had to beg their fleeing subscribers for forgiveness in that they… https://t.co/brrb08KJS9",-PRON- election nytime beg flee subscriber forgiveness -PRON- httpstcobrrbkjs,[],20611,0.0,0,0,2019,4,13,1555198707000000000,1555113600000.0
1695,1117208514202669056,1,2019-04-13 23:30:41,The New York Times Sanctuary Cities/Immigration story today was knowingly wrong on almost every fact. They never ca… https://t.co/yTiyKAgJEv,new york time sanctuary citiesimmigration story today knowingly wrong almost every fact -PRON- never ca httpstcoytiykagjev,[],20275,-0.18181818181818182,0,0,2019,4,13,1555198241000000000,1555113600000.0
1696,1117195221891203077,1,2019-04-13 22:37:52,Great playing by @TigerWoods (at the) @TheMasters. Tomorrow will be a big and exciting day for golf and for sports.… https://t.co/85XsTizsnf,great play tigerwood themaster tomorrow big exciting day golf sport httpstcoxstizsnf,[],11967,0.3666666666666667,1,0,2019,4,13,1555195072000000000,1555113600000.0
1697,1117040007016009728,1,2019-04-13 12:21:05,"Why should Radical Left Democrats in Congress have a right to retry and examine the $35,000,000 (two years in the m… https://t.co/swbEzODOpw",radical leave democrat congress right retry examine two year httpstcoswbezodopw,[],29463,0.2857142857142857,1,0,2019,4,13,1555158065000000000,1555113600000.0
1698,1117035779589648386,1,2019-04-13 12:04:18,"....extraordinary growth, economic success and riches under the leadership of Chairman Kim. I look forward to the d… https://t.co/6qKwPbbrPH",extraordinary growth economic success rich leadership chairman kim -PRON- look forward httpstcoqkwpbbrph,[],15711,0.3020833333333333,1,0,2019,4,13,1555157058000000000,1555113600000.0
1699,1117033379776667648,1,2019-04-13 11:54:45,"I agree with Kim Jong Un of North Korea that our personal relationship remains very good, perhaps the term excellen… https://t.co/6XKPFapPd8",-PRON- agree kim jong north korea personal relationship remain good perhaps term excellen httpstcoxkpfappd,[],18126,0.35,1,0,2019,4,13,1555156485000000000,1555113600000.0
1700,1116911640568573952,1,2019-04-13 03:51:00,"In New York State, Democrats blocked a Bill expanding College Tuition for Gold Star families after approving aid fo… https://t.co/3NIUtb0gcm",new york state democrat block bill expand college tuition gold star family approve aid fo httpstconiutbgcm,[],32272,0.13636363636363635,0,0,2019,4,13,1555127460000000000,1555113600000.0
1701,1116907128445394944,1,2019-04-13 03:33:05,Another Fake Story on @NBCNews that I offered Pardons to Homeland Securiy personnel in case they broke the law rega… https://t.co/zq0NpnzYUD,another fake story nbcnew -PRON- offer pardon homeland securiy personnel case break law rega httpstcozqnpnzyud,[],27650,-0.5,0,1,2019,4,13,1555126385000000000,1555113600000.0
1702,1116898703682543616,1,2019-04-13 02:59:36,A Fake Story by Politico. Made up sources. Thank you Mount Vernon! https://t.co/Pf60zBy6Sw,fake story politico make source thank mount vernon httpstcopfzbysw,[],15993,-0.5,0,1,2019,4,13,1555124376000000000,1555113600000.0
1703,1116894304063107072,1,2019-04-13 02:42:07,"Finally, great news at the Border! https://t.co/nofzYa2Qs7",finally great news border httpstconofzyaqs,[],8351,0.8,1,0,2019,4,13,1555123327000000000,1555113600000.0
1704,1116892526533857280,1,2019-04-13 02:35:03,"Thank you Jeh, so well stated! https://t.co/4QmP6XrUVA",thank jeh well state httpstcoqmpxruva,[],13853,0.0,0,0,2019,4,13,1555122903000000000,1555113600000.0
1705,1116891452003557376,1,2019-04-13 02:30:47,If the Radical Left Democrats all of a sudden don’t want the Illegal Migrants in their Sanctuary Cities (no more op… https://t.co/QV1KGbo81v,radical leave democrat sudden want illegal migrant sanctuary city op httpstcoqvkgbov,[],32440,-0.25,0,1,2019,4,13,1555122647000000000,1555113600000.0
1706,1116845082945171457,1,2019-04-12 23:26:32,WSJ's Strassel: Barr 'Right' to Say 'Spying' Occurred on Trump Campaign | Breitbart https://t.co/YuC9IX01GF via @BreitbartNews,wsj strassel barr right say spy occur trump campaign breitbart httpstcoyucixgf via breitbartnew,[],14859,0.2857142857142857,1,0,2019,4,12,1555111592000000000,1555027200000.0
1707,1116817144006750209,1,2019-04-12 21:35:31,WE WILL NEVER FORGET! https://t.co/VxrGFRFeJM,never forget httpstcovxrgfrfejm,[],99035,0.0,0,0,2019,4,12,1555104931000000000,1555027200000.0
1708,1116742282286440448,1,2019-04-12 16:38:02,"....The Radical Left always seems to have an Open Borders, Open Arms policy – so this should make them very happy!",radical leave always seem open border open arm policy make happy,[],25242,0.26666666666666666,1,0,2019,4,12,1555087082000000000,1555027200000.0
1709,1116742280919044096,1,2019-04-12 16:38:02,"Due to the fact that Democrats are unwilling to change our very dangerous immigration laws, we are indeed, as repor… https://t.co/sNDauZ3JDv",due fact democrat unwilling change dangerous immigration law indeed repor httpstcosndauzjdv,[],39095,-0.3625,0,1,2019,4,12,1555087082000000000,1555027200000.0
1710,1116707442061193217,1,2019-04-12 14:19:36,"Even the Democrats now say that our Southern Border is a Crisis and a National Emergency. Hopefully, we will not be… https://t.co/CID3xfQPBK",even democrat say southern border crisis national emergency hopefully httpstcocidxfqpbk,[],17661,0.0,0,0,2019,4,12,1555078776000000000,1555027200000.0
