,id_str,id,created_at,text,text_cleaned,hashtags,retweet_count,sentiment,positive_sentiment,negative_sentiment,created_year,created_month,created_day,created_at_int,date
499,1153290669424807936,1,2019-07-22 13:08:17,The Report of Iran capturing CIA spies is totally false. Zero truth. Just more lies and propaganda (like their shot… https://t.co/6GD19cmzCe,report iran capture cia spy totally false zero truth lie propaganda like shoot httpstcogdcmzce,[],21325,-0.25000000000000006,0,1,2019,7,22,1563800897000000000,1563753600000.0
500,1153286989824888832,1,2019-07-22 12:53:40,"....But the questions should be asked, why were all of Clinton’s people given immunity, and why were the text messa… https://t.co/cQ522ZYtd8",question ask clinton people give immunity text messa httpstcocqzytd,[],21500,0.0,0,0,2019,7,22,1563800020000000000,1563753600000.0
501,1153286989053079552,1,2019-07-22 12:53:39,Highly conflicted Robert Mueller should not be given another bite at the apple. In the end it will be bad for him a… https://t.co/UVKsmG6vLG,highly conflict robert mueller give another bite apple end bad httpstcouvksmgvlg,[],21448,-0.2699999999999999,0,1,2019,7,22,1563800019000000000,1563753600000.0
502,1153283267572858880,1,2019-07-22 12:38:52,Fake News Equals the Enemy of the People!,fake news equal enemy people,[],28455,-0.25,0,1,2019,7,22,1563799132000000000,1563753600000.0
503,1153282896549036032,1,2019-07-22 12:37:24,The Mainstream Media is out of control. They constantly lie and cheat in order to get their Radical Left Democrat v… https://t.co/H8r4mRUnst,mainstream medium control -PRON- constantly lie cheat order get radical leave democrat httpstcohrmrunst,[],25493,0.0,0,0,2019,7,22,1563799044000000000,1563753600000.0
504,1153281480073908224,1,2019-07-22 12:31:46,"....except for those stated by me, &amp; “reams of paper” were never given to me. It is a made up story meant to demean… https://t.co/RVIkDw5BLj",except state amp ream paper never give -PRON- make story mean demean httpstcorvikdwblj,[],14293,-0.3125,0,1,2019,7,22,1563798706000000000,1563753600000.0
505,1153281479184658433,1,2019-07-22 12:31:46,The Amazon Washington Post front page story yesterday was total Fake News. They said “Advisors wrote new talking po… https://t.co/u143RpgGUs,amazon washington post front page story yesterday total fake news -PRON- say advisor write new talk po httpstcourpggu,[],15573,-0.12121212121212122,0,0,2019,7,22,1563798706000000000,1563753600000.0
506,1153274794579767296,1,2019-07-22 12:05:12,"It is far more costly for the Federal Reserve to cut deeper if the economy actually does, in the future, turn down!… https://t.co/SSp8SBXNeW",-PRON- far costly federal reserve cut deep economy actually future turn httpstcosspsbxnew,[],13274,0.03333333333333333,0,0,2019,7,22,1563797112000000000,1563753600000.0
507,1153274075155959808,1,2019-07-22 12:02:20,"....as we have done, it could have been soooo much better. Interest rate costs should have been much lower, &amp; GDP &amp;… https://t.co/1uQLACvA8A",could soooo much good interest rate cost much low amp gdp amp httpstcouqlacvaa,[],13825,0.35,1,0,2019,7,22,1563796940000000000,1563753600000.0
508,1153274069028089856,1,2019-07-22 12:02:19,"With almost no inflation, our Country is needlessly being forced to pay a MUCH higher interest rate than other coun… https://t.co/j4zVcuQBVX",almost inflation country needlessly force pay much high interest rate coun httpstcojzvcuqbvx,[],16774,-0.16999999999999998,0,0,2019,7,22,1563796939000000000,1563753600000.0
509,1153136335584202752,1,2019-07-22 02:55:01,https://t.co/1DVvqFQxRK,httpstcodvvqfqxrk,[],13646,0.0,0,0,2019,7,22,1563764101000000000,1563753600000.0
510,1153136333994582016,1,2019-07-22 02:55:00,"Thank you very much for revealing the incredible facts, which the Fake News Media will never do! @SteveHiltonx… https://t.co/9EFtaomfKh",thank much reveal incredible fact fake news medium never stevehiltonx httpstcoeftaomfkh,[],22302,0.20000000000000004,1,0,2019,7,22,1563764100000000000,1563753600000.0
511,1153134339867250694,1,2019-07-22 02:47:05,https://t.co/2lPjfxOKq3,httpstcolpjfxokq,[],16602,0.0,0,0,2019,7,22,1563763625000000000,1563753600000.0
512,1153126580652318720,1,2019-07-22 02:16:15,"....Based on the comments made by Senator Schumer, he must have seen how dangerous &amp; bad for our Country the Border… https://t.co/rpyZCeqxLI",base comment make senator schumer must see dangerous amp bad country border httpstcorpyzceqxli,[],19589,-0.6999999999999998,0,1,2019,7,22,1563761775000000000,1563753600000.0
513,1153126579641495552,1,2019-07-22 02:16:15,Senator Chuck Schumer has finally gone to the Southern Border with some Democrat Senators. This is a GREAT thing! N… https://t.co/lae9K2Ldcf,senator chuck schumer finally go southern border democrat senator great thing httpstcolaekldcf,[],21317,0.4,1,0,2019,7,22,1563761775000000000,1563753600000.0
514,1153040324241088512,1,2019-07-21 20:33:30,"....Most importantly you have led Israel with a commitment to the values of democracy, freedom, and equal opportuni… https://t.co/RYyS1fHnIo",importantly lead israel commitment value democracy freedom equal opportuni httpstcoryysfhnio,[],17211,0.2,0,0,2019,7,21,1563741210000000000,1563667200000.0
515,1153040319866462208,1,2019-07-21 20:33:29,Congratulations to Bibi @Netanyahu on becoming the longest serving PM in the history of Israel. Under your leadersh… https://t.co/DHOUaqHRZW,congratulation bibi netanyahu become long serve pm history israel leadersh httpstcodhouaqhrzw,[],24824,-0.05,0,0,2019,7,21,1563741209000000000,1563667200000.0
516,1152912995938443269,1,2019-07-21 12:07:32,I don’t believe the four Congresswomen are capable of loving our Country. They should apologize to America (and Isr… https://t.co/EFUvL4LQOa,-PRON- believe four congresswoman capable love country -PRON- apologize america isr httpstcoefuvllqoa,[],40577,0.35,1,0,2019,7,21,1563710852000000000,1563667200000.0
517,1152911185441906689,1,2019-07-21 12:00:21,MAKE AMERICA GREAT AGAIN!,make america great,[],42649,0.8,1,0,2019,7,21,1563710421000000000,1563667200000.0
518,1152910967220690945,1,2019-07-21 11:59:29,Presidential Harassment!,presidential harassment,[],20395,0.0,0,0,2019,7,21,1563710369000000000,1563667200000.0
519,1152910721199595520,1,2019-07-21 11:58:30,"The Washington Post Story, about my speech in North Carolina and tweet, with its phony sources who do not exist, is… https://t.co/CLLclXuxDN",washington post story speech north carolina tweet phony source exist httpstcocllclxuxdn,[],17789,0.0,0,0,2019,7,21,1563710310000000000,1563667200000.0
520,1152899604473667585,1,2019-07-21 11:14:20,"Big progress at the Border, but Dems in Congress must change the Immigration Laws for all to be good! End the Loopholes and much more.",big progress border dem congress must change immigration law good end loophole much,[],16530,0.3,1,0,2019,7,21,1563707660000000000,1563667200000.0
521,1152894521463754752,1,2019-07-21 10:54:08,The Great State of West Virginia is producing record setting numbers and doing really well. When I became President… https://t.co/PPAbojuStO,great state west virginia produce record set number really well -PRON- become president httpstcoppabojusto,[],17844,0.5,1,0,2019,7,21,1563706448000000000,1563667200000.0
522,1152891090544078848,1,2019-07-21 10:40:30,"I will help Angel Mom (and great woman) Mary Ann Mendoza with Twitter. I know Mary Ann from the beginning, and she… https://t.co/qJgZrQl7fD",-PRON- help angel mom great woman mary ann mendoza twitter -PRON- know mary ann begin -PRON- httpstcoqjgzrqlfd,[],30440,0.8,1,0,2019,7,21,1563705630000000000,1563667200000.0
523,1152713896303714304,1,2019-07-20 22:56:23,"Economic numbers reach an all time high, the best in our Country’s history. Great to be a part of something so good for so many!",economic number reach time high good country history great part something good many,[],22568,0.51,1,0,2019,7,20,1563663383000000000,1563580800000.0
524,1152579779297759232,1,2019-07-20 14:03:27,https://t.co/aG45A3Ugnp,httpstcoagaugnp,[],26336,0.0,0,0,2019,7,20,1563631407000000000,1563580800000.0
525,1152577021668728832,1,2019-07-20 13:52:30,"....Our teams will be talking further, and we agreed to speak again in the next 48 hours!",-PRON- team talk agree speak next hour,[],14474,0.0,0,0,2019,7,20,1563630750000000000,1563580800000.0
526,1152577020594917376,1,2019-07-20 13:52:30,Just had a very good call with @SwedishPM Stefan Löfven who assured me that American citizen A$AP Rocky will be tre… https://t.co/9YiyUPTj1I,good call swedishpm stefan löfven assure american citizen aap rocky tre httpstcoyiyuptji,[],31455,0.35,1,0,2019,7,20,1563630750000000000,1563580800000.0
527,1152538139153567744,1,2019-07-20 11:18:00,You can add 10% or 15% to this number. Economy doing better than EVER before! https://t.co/o59vI5tzXn,-PRON- add number economy good ever httpstcoovitzxn,[],18915,0.7,1,0,2019,7,20,1563621480000000000,1563580800000.0
528,1152536577953935360,1,2019-07-20 11:11:47,Thank you Bill. Very nice! https://t.co/hTnGiOh6T1,thank bill nice httpstcohtngioht,[],13917,0.6,1,0,2019,7,20,1563621107000000000,1563580800000.0
529,1152532958487748609,1,2019-07-20 10:57:24,"As you can see, I did nothing to lead people on, nor was I particularly happy with their chant. Just a very big and… https://t.co/A8wXOVSvsx",see -PRON- nothing lead people -PRON- particularly happy chant big httpstcoawxovsvsx,[],17367,0.4,1,0,2019,7,20,1563620244000000000,1563580800000.0
530,1152528914482388992,1,2019-07-20 10:41:20,"With the incompetent Mayor of London, you will never have safe streets! https://t.co/pJqL1NjyvA",incompetent mayor london never safe street httpstcopjqlnjyva,[],20570,-0.3,0,1,2019,7,20,1563619280000000000,1563580800000.0
531,1152307567634391041,1,2019-07-19 20:01:47,Just spoke to @KanyeWest about his friend A$AP Rocky’s incarceration. I will be calling the very talented Prime Min… https://t.co/NbKHYs2QUX,speak kanyewest friend aap rocky incarceration -PRON- call talented prime min httpstconbkhysqux,[],206019,0.7,1,0,2019,7,19,1563566507000000000,1563494400000.0
532,1152228353040011264,1,2019-07-19 14:47:01,Thank you! #MAGA2020 https://t.co/6G2TinCpWT,thank maga httpstcogtincpwt,['MAGA2020'],20667,0.0,0,0,2019,7,19,1563547621000000000,1563494400000.0
533,1152212059263819777,1,2019-07-19 13:42:16,....Fed: There is almost no inflation!,fed almost inflation,[],9797,0.0,0,0,2019,7,19,1563543736000000000,1563494400000.0
534,1152211072851619840,1,2019-07-19 13:38:21,"....but it is no thanks to the Federal Reserve. Had they not acted so fast and “so much,” we would be doing even be… https://t.co/H5tdA4fJxi",thank federal reserve act fast much would even httpstcohtdafjxi,[],11628,0.2,0,0,2019,7,19,1563543501000000000,1563494400000.0
535,1152211071350054913,1,2019-07-19 13:38:21,I like New York Fed President John Williams first statement much better than his second. His first statement is 100… https://t.co/zR7KIy2Z6r,-PRON- like new york fed president john williams first statement much good second -PRON- first statement httpstcozrkiyzr,[],12804,0.2672727272727273,1,0,2019,7,19,1563543501000000000,1563494400000.0
536,1152197164883435521,1,2019-07-19 12:43:05,"Because of the faulty thought process we have going for us at the Federal Reserve, we pay much higher interest rate… https://t.co/vufptVrS14",faulty think process go -PRON- federal reserve pay much high interest rate httpstcovufptvrs,[],15438,0.16,0,0,2019,7,19,1563540185000000000,1563494400000.0
537,1152195096517009409,1,2019-07-19 12:34:52,....Governor of the State did a good  job. That may be true but she could not have done it without the tremendous e… https://t.co/o18MOvBQ00,governor state good job may true could without tremendous httpstcoomovbq,[],13893,0.461111111111111,1,0,2019,7,19,1563539692000000000,1563494400000.0
538,1152195095430651904,1,2019-07-19 12:34:52,"....he could not have been nicer or more respectful to your favorite President, me. Then I saw the column he wrote,… https://t.co/wpd3eWeFpn",could nice respectful favorite president -PRON- see column write httpstcowpdewefpn,[],11451,0.5333333333333333,1,0,2019,7,19,1563539692000000000,1563494400000.0
539,1152195094398873602,1,2019-07-19 12:34:51,"Thomas “the Chin” Friedman, a weak and pathetic sort of guy, writes columns for The New York Times in between round… https://t.co/DVIv3LAFwF",thomas chin friedman weak pathetic sort guy write column new york time round httpstcodvivlafwf,[],14067,-0.35965909090909093,0,1,2019,7,19,1563539691000000000,1563494400000.0
540,1152190440692756481,1,2019-07-19 12:16:22,"....State which I will win in #2020 because they can’t stand her and her hatred of our Country, and they appreciate… https://t.co/2WkVWfvWZl",state -PRON- win stand hatred country appreciate httpstcowkvwfvwzl,[],15146,0.8,1,0,2019,7,19,1563538582000000000,1563494400000.0
541,1152190439325339648,1,2019-07-19 12:16:22,"....Mainstream Media, which has lost all credibility, has either officially or unofficially become a part of the Ra… https://t.co/LWoKc2NRXX",mainstream medium lose credibility either officially unofficially become part ra httpstcolwokcnrxx,[],15309,0.0,0,0,2019,7,19,1563538582000000000,1563494400000.0
542,1152190436825604096,1,2019-07-19 12:16:21,It is amazing how the Fake News Media became “crazed” over the chant “send her back” by a packed Arena (a record) c… https://t.co/iBaECLN3hS,-PRON- amazing fake news medium become craze chant send back pack arena record httpstcoibaeclnhs,[],25465,0.03333333333333336,0,0,2019,7,19,1563538581000000000,1563494400000.0
543,1152180262849175553,1,2019-07-19 11:35:55,"Great new book, “Justice On Trial, The Kavanaugh Confirmation and the Future of the Supreme Court.” Fantastic job b… https://t.co/DBGvN5zOYz",great new book justice trial kavanaugh confirmation future supreme court fantastic job httpstcodbgvnzoyz,[],12037,0.3340909090909091,1,0,2019,7,19,1563536155000000000,1563494400000.0
544,1152049031805317120,1,2019-07-19 02:54:27,https://t.co/D7H1Wr1LHy,httpstcodhwrlhy,[],26877,0.0,0,0,2019,7,19,1563504867000000000,1563494400000.0
545,1152010855552180224,1,2019-07-19 00:22:45,....working with labor and everyone else. He will be a great member of an Administration that has done more in the… https://t.co/wmPY2Cm1If,work labor everyone else -PRON- great member administration httpstcowmpycmif,[],13624,0.8,1,0,2019,7,19,1563495765000000000,1563494400000.0
546,1152010854176452608,1,2019-07-19 00:22:45,I am pleased to announce that it is my intention to nominate Gene Scalia as the new Secretary of Labor. Gene has le… https://t.co/iYXF7BTm8Y,-PRON- pleased announce intention nominate gene scalia new secretary labor gene httpstcoiyxfbtmy,[],18832,0.3181818181818182,1,0,2019,7,19,1563495765000000000,1563494400000.0
547,1151978502842986496,1,2019-07-18 22:14:12,"Today, @FLOTUS Melania and I were honored to welcome members of Team USA to the @WhiteHouse for a great celebration… https://t.co/O9wwZrP8a8",today flotu melania -PRON- honor welcome member team usa whitehouse great celebration httpstcoowwzrpa,[],23158,0.8,1,0,2019,7,18,1563488052000000000,1563408000000.0
548,1151968286122369029,1,2019-07-18 21:33:36,"This should have been taken care of years ago, the Trump Administration is taking care of these thugs now!
https://t.co/ulqagIAtxI",take care year ago trump administration take care thug httpstcoulqagiatxi,[],20594,0.0,0,0,2019,7,18,1563485616000000000,1563408000000.0
549,1151953616510574607,1,2019-07-18 20:35:19,"Today, on behalf of the American people, I received an American flag that flew aboard a ship carrying the first wav… https://t.co/bZ5ghgOxmF",today behalf american people -PRON- receive american flag fly aboard ship carry first wav httpstcobzghgoxmf,[],18422,0.2625,1,0,2019,7,18,1563482119000000000,1563408000000.0
550,1151948135868051457,1,2019-07-18 20:13:32,"I want to apprise everyone of an incident in the Strait of Hormuz today, involving #USSBoxer, a U.S. Navy amphibiou… https://t.co/P49VERsayu",-PRON- want apprise everyone incident strait hormuz today involve ussboxer us navy amphibiou httpstcopversayu,['USSBoxer'],17528,0.0,0,0,2019,7,18,1563480812000000000,1563408000000.0
551,1151871836541607936,1,2019-07-18 15:10:21,"....of gang members, in particular MS-13. ICE and Border Patrol are doing a great job!",gang member particular ms ice border patrol great job,[],16045,0.48333333333333334,1,0,2019,7,18,1563462621000000000,1563408000000.0
552,1151871835564326918,1,2019-07-18 15:10:20,"Most of the MS-13 Gang members indicted &amp; arrested in L.A. were illegal aliens, 19 of 22. They are said to have kil… https://t.co/63725T5kY4",ms gang member indict amp arrest illegal alien -PRON- say kil httpstcotky,[],24230,-0.26666666666666666,0,1,2019,7,18,1563462620000000000,1563408000000.0
553,1151867786236440576,1,2019-07-18 14:54:15,"....of which was squandered away or wasted, never to be seen again. This is more than twice the amount given to Tex… https://t.co/yKeZ0y58Nh",squander away waste never see twice amount give tex httpstcoykezynh,[],23180,-0.2,0,0,2019,7,18,1563461655000000000,1563408000000.0
554,1151867785368281089,1,2019-07-18 14:54:15,"A lot of bad things are happening in Puerto Rico. The Governor is under siege, the Mayor of San Juan is a despicabl… https://t.co/DtdQFiNoZx",lot bad thing happen puerto rico governor siege mayor san juan despicabl httpstcodtdqfinozx,[],27537,-0.6999999999999998,0,1,2019,7,18,1563461655000000000,1563408000000.0
555,1151700953030123522,1,2019-07-18 03:51:19,"Just returned to the White House from the Great State of North Carolina. What a crowd, and what great people. The e… https://t.co/1JBzcvWiLe",return white house great state north carolina crowd great people httpstcojbzcvwile,[],24761,0.5333333333333333,1,0,2019,7,18,1563421879000000000,1563408000000.0
556,1151668590359265280,1,2019-07-18 01:42:43,"The Republican Party is the Party for ALL Americans. We are the Party of the American Worker, the American Family &amp;… https://t.co/Pb8QmQOqMn",republican party party american -PRON- party american worker american family amp httpstcopbqmqoqmn,[],22261,0.0,0,0,2019,7,18,1563414163000000000,1563408000000.0
557,1151661766562275328,1,2019-07-18 01:15:36,"Together, we will continue unleashing the power of American enterprise, so every American can know the dignity of w… https://t.co/Lm28Ljwh5i",together continue unleash power american enterprise every american know dignity httpstcolmljwhi,[],18934,0.0,0,0,2019,7,18,1563412536000000000,1563408000000.0
558,1151659345278623744,1,2019-07-18 01:05:59,"THANK YOU Greenville, North Carolina! #MAGA2020 https://t.co/3ou3JzHsQX",thank greenville north carolina maga httpstcooujzhsqx,['MAGA2020'],19543,0.0,0,0,2019,7,18,1563411959000000000,1563408000000.0
559,1151618791069114368,1,2019-07-17 22:24:50,"....Greatest Economic BOOM in the history of our Country, the best job numbers, biggest tax reduction, rebuilt mili… https://t.co/3lMTVJvlBe",great economic boom history country good job number big tax reduction rebuild mili httpstcolmtvjvlbe,[],24221,0.425,1,0,2019,7,17,1563402290000000000,1563321600000.0
560,1151618789664071681,1,2019-07-17 22:24:50,"The United States House of Representatives has just overwhelmingly voted to kill the Resolution on Impeachment, 332… https://t.co/2rhYOwYzp4",united state house representative overwhelmingly vote kill resolution impeachment httpstcorhyowyzp,[],28813,0.5,1,0,2019,7,17,1563402290000000000,1563321600000.0
561,1151576111186399232,1,2019-07-17 19:35:14,"See you tonight, North Carolina! #MAGA2020 https://t.co/rqOwEkTtqQ",see tonight north carolina maga httpstcorqowekttqq,['MAGA2020'],17648,0.0,0,0,2019,7,17,1563392114000000000,1563321600000.0
562,1151526698392965123,1,2019-07-17 16:18:53,GOD BLESS THE USA🇺🇸 https://t.co/w6FenobnlR,god bless usa httpstcowfenobnlr,[],41355,0.0,0,0,2019,7,17,1563380333000000000,1563321600000.0
563,1151499379821428736,1,2019-07-17 14:30:20,"New Poll: The Rasmussen Poll, one of the most accurate in predicting the 2016 Election, has just announced that “Tr… https://t.co/e3gEj3Su0h",new poll rasmussen poll one accurate predict election announce tr httpstcoegejsuh,[],31038,0.2681818181818182,1,0,2019,7,17,1563373820000000000,1563321600000.0
564,1151495794295525378,1,2019-07-17 14:16:05,"After a ten year search, the so-called “mastermind” of the Mumbai Terror attacks has been arrested in Pakistan. Gre… https://t.co/XoxP9gak3j",ten year search socalled mastermind mumbai terror attack arrest pakistan gre httpstcoxoxpgakj,[],34453,-0.025,0,0,2019,7,17,1563372965000000000,1563321600000.0
565,1151473175496146945,1,2019-07-17 12:46:13,"Big Rally tonight in Greenville, North Carolina. Lots of great things to tell you about, including the fact that ou… https://t.co/UWb4OOo6Dx",big rally tonight greenville north carolina lot great thing tell include fact ou httpstcouwbooodx,[],23622,0.4,1,0,2019,7,17,1563367573000000000,1563321600000.0
566,1151451591171543041,1,2019-07-17 11:20:26,"The Democrats in Congress are getting nothing done, not on drug pricing, not on immigration, not on infrastructure,… https://t.co/Up7YILcEvq",democrat congress get nothing drug pricing immigration infrastructure httpstcoupyilcevq,[],29697,0.0,0,0,2019,7,17,1563362426000000000,1563321600000.0
567,1151451068431294464,1,2019-07-17 11:18:22,....they are destroying the Democrat Party. I’m appalled that so many of our Presidential candidates are falling al… https://t.co/q6TFFoInIs,destroy democrat party -PRON- appal many presidential candidate fall httpstcoqtffoinis,[],30296,0.15,0,0,2019,7,17,1563362302000000000,1563321600000.0
568,1151451067437191168,1,2019-07-17 11:18:22,"...opinion, they’re Americans. Now I’m entitled to my opinion, &amp; I just think they’re left wing cranks. They’re the… https://t.co/LvUu2IXZO7",opinion american -PRON- entitle opinion amp -PRON- think leave wing crank -PRON- httpstcolvuuixzo,[],28679,0.0,0,0,2019,7,17,1563362302000000000,1563321600000.0
569,1151451061670088704,1,2019-07-17 11:18:20,"“In America, if you hate our Country, you are free to leave. The simple fact of the matter is, the four Congresswom… https://t.co/LCXtLlpsvn",america hate country free leave simple fact matter four congresswom httpstcolcxtllpsvn,[],36444,-0.13333333333333333,0,0,2019,7,17,1563362300000000000,1563321600000.0
570,1151327084016480257,1,2019-07-17 03:05:42,"....visible members of the House Democrats, who are now wedded to this bitterness and hate. The Republican vote was… https://t.co/XvLZidUI7r",visible member house democrat wed bitterness hate republican vote httpstcoxvlziduir,[],26354,-0.8,0,1,2019,7,17,1563332742000000000,1563321600000.0
571,1151327083110510594,1,2019-07-17 03:05:41,So great to see how unified the Republican Party was on today’s vote concerning statements I made about four Democr… https://t.co/PxFy8wPIGG,great see unify republican party today vote concern statement -PRON- make four democr httpstcopxfywpigg,[],29173,0.8,1,0,2019,7,17,1563332741000000000,1563321600000.0
572,1151251538079301634,1,2019-07-16 22:05:30,"Yesterday, it was my great honor to host our third annual Made in America Showcase at the @WhiteHouse.... https://t.co/mBha7Qprr9",yesterday great honor host third annual make america showcase whitehouse httpstcombhaqprr,[],21753,0.4,1,0,2019,7,16,1563314730000000000,1563235200000.0
573,1151246142769946625,1,2019-07-16 21:44:04,"Looking forward to tomorrow night’s rally in Greenville, North Carolina at 7:00 P.M. Eastern! https://t.co/oXRgDvjacc",look forward tomorrow night rally greenville north carolina pm eastern httpstcooxrgdvjacc,[],18333,0.0,0,0,2019,7,16,1563313444000000000,1563235200000.0
574,1151147417028497414,1,2019-07-16 15:11:46,"Kevin McCarthy @GOPLeader, “The President’s Tweets were not Racist. The controversy over the tweets is ALL POLITICS… https://t.co/FLZRSiUqNc",kevin mccarthy gopleader president tweet racist controversy tweet politics httpstcoflzrsiuqnc,[],23335,0.0,0,0,2019,7,16,1563289906000000000,1563235200000.0
575,1151129281919102976,1,2019-07-16 13:59:42,".....Congresswomen, who I truly believe, based on their actions, hate our Country. Get a list of the HORRIBLE thing… https://t.co/mnDj43eq1k",congresswoman -PRON- truly believe base action hate country get list horrible thing httpstcomndjeqk,[],30013,-0.625,0,1,2019,7,16,1563285582000000000,1563235200000.0
576,1151129281134768128,1,2019-07-16 13:59:42,Those Tweets were NOT Racist. I don’t have a Racist bone in my body! The so-called vote to be taken is a Democrat c… https://t.co/jAGPz1saBI,tweet racist -PRON- racist bone body socalled vote take democrat httpstcojagpzsabi,[],41820,0.0,0,0,2019,7,16,1563285582000000000,1563235200000.0
577,1151103647637487616,1,2019-07-16 12:17:50,"Our Country is Free, Beautiful and Very Successful. If you hate our Country, or if you are not happy here, you can leave!",-PRON- country free beautiful successful hate country happy leave,[],75190,0.4,1,0,2019,7,16,1563279470000000000,1563235200000.0
578,1151099363445358592,1,2019-07-16 12:00:49,"If you come after the President, the Country, the Flag - he’s going to defend himself. What the squad doesn’t like… https://t.co/Zq8pGewq31",come president country flag go defend squad like httpstcozqpgewq,[],30307,0.0,0,0,2019,7,16,1563278449000000000,1563235200000.0
579,1151095675213553664,1,2019-07-16 11:46:09,“Billionaire Tech Investor Peter Thiel believes Google should be investigated for treason. He accuses Google of wor… https://t.co/OXOb83lfoB,billionaire tech investor peter thiel believe google investigate treason -PRON- accuse google wor httpstcooxoblfob,[],29213,0.0,0,0,2019,7,16,1563277569000000000,1563235200000.0
